{
  "schema_version": "sllm-phase46-kv-quality-dataset-v1",
  "dataset_id": "phase46-kv-quality-baseline-v1",
  "license": "CC0-1.0",
  "provenance": "Project-authored deterministic token-ID boundary fixtures; contains no copied prompt or response text.",
  "seed": 1729,
  "token_generator": "token[i] = 1 + ((start + i * step + seed) mod 200000)",
  "sample_order": "listed",
  "cases": [
    {"id": "b001", "length": 1, "start": 3, "step": 17, "expected_next": 1750, "band": "early", "block_tail": false},
    {"id": "b015", "length": 15, "start": 5, "step": 19, "expected_next": 2020, "band": "early", "block_tail": true},
    {"id": "b016", "length": 16, "start": 7, "step": 23, "expected_next": 2105, "band": "early", "block_tail": false},
    {"id": "b017", "length": 17, "start": 11, "step": 29, "expected_next": 2234, "band": "middle", "block_tail": false},
    {"id": "b255", "length": 255, "start": 13, "step": 31, "expected_next": 9648, "band": "middle", "block_tail": true},
    {"id": "b256", "length": 256, "start": 17, "step": 37, "expected_next": 11219, "band": "middle", "block_tail": false},
    {"id": "b257", "length": 257, "start": 19, "step": 41, "expected_next": 12286, "band": "tail", "block_tail": false},
    {"id": "b511", "length": 511, "start": 23, "step": 43, "expected_next": 23726, "band": "tail", "block_tail": true},
    {"id": "b512", "length": 512, "start": 29, "step": 47, "expected_next": 25823, "band": "tail", "block_tail": false},
    {"id": "b513", "length": 513, "start": 31, "step": 53, "expected_next": 28950, "band": "tail", "block_tail": false}
  ],
  "coverage": {
    "kv_planes": ["K", "V"],
    "layers": [0, 13, 27],
    "kv_heads": [0, 1, 3],
    "position_bands": ["early", "middle", "tail"],
    "boundaries": [1, 15, 16, 17, 255, 256, 257, 511, 512, 513]
  }
}
